Character,Line
Leslie Knope,"I am prepared to put the Wamapoke history exhibit inside the carnival grounds, right past the entrance turnstile, so that you have to look at it before you start having fun."
Ken Hotate,"Now, that's interesting."
Extra,It's been really awesome looking at you.
Extra,Most carnival nurses are total grenades.
Ann Perkins,"Okay, you're all set."
Ann Perkins,You are free to go.
Ann Perkins,Or you could stay here and make out with me until the lights come back on.
Extra,"Hell, yeah."
Ann Perkins,"Beat it, Donna."
Donna Meagle,"Aye-aye, Captain."
Leslie Knope,"I'm just trying to do something good for this town, and I'm trying to save my friends' jobs."
Leslie Knope,Can you help me out here?
Ken Hotate,A Native American tribe making a deal with the government. What could go wrong?
Ken Hotate,"You can have the generator, Leslie."
Leslie Knope,"Thank you, Ken."
Ken Hotate,And I will issue a statement saying that the curse has been lifted.
Leslie Knope,"Well, actually, I have another idea."
Ken Hotate,"With that sacred ceremony, the Wamapoke curse has been lifted."
Leslie Knope,Wow.
Leslie Knope,Thank you.
Leslie Knope,Intense stuff from Ken Hotate.
Leslie Knope,"And in other good news, he gave us a scare, but he's back now."
Leslie Knope,"The one, the only, Little Sebastian."
Ron Swanson,"We spotted him from the top of the Ferris wheel, at the center of the corn maze."
Ron Swanson,"After the power came back on, we went and got him."
Ron Swanson,It took us four hours to solve that maze.
Ron Swanson,It took the horse 15 minutes.
Ron Swanson,Jerry's still out there.
Ron Swanson,I suppose I ought to go look for him.
Ron Swanson,Right after I get a bratwurst.
Extra,Knock knock. Hey hot lips. I got out of here so fast last night I wasn't able to scoop them digits off of you.
Ann Perkins,"Oh um, that's because I didn't give them to you."
Extra,"I don't mean to brag, but I'm in the emergency room like all the time."
Ann Perkins,He was really sweet though. I'm just gonna see if maybe he wants to grab some
Donna Meagle,Park it.
Ann Perkins,Fine.
Leslie Knope,Welcome.
Leslie Knope,Come on in.
Leslie Knope,Have fun.
Extra,Thanks.
Leslie Knope,"Enjoy yourself, ladies."
Ben Wyatt,Hey.
Leslie Knope,Hey.
Leslie Knope,Look who's back.
Ben Wyatt,I'm sorry I left.
Ben Wyatt,I honestly felt like I was cursed or something.
Ben Wyatt,"Ice Town, and now, this."
Leslie Knope,"Ice Town was a disaster, and it seems like it was probably your fault."
Leslie Knope,"From what I can tell, you mismanaged the hell out of it."
Ben Wyatt,Wow. Why even say that already?
Leslie Knope,"But the point is, this project, this is as much yours as it is mine."
Leslie Knope,"It's ours, and it's going to be really great."
Leslie Knope,And I'm glad you're here.
Ben Wyatt,Wow.
Ben Wyatt,Thank you.
Ken Hotate,Is this the guy?
Leslie Knope,Yes. This is him.
Ben Wyatt,"Ah, yes."
Leslie Knope,Special Wamapoke ceremony.
Leslie Knope,The curse has been lifted.
Ben Wyatt,Wow.
Ben Wyatt,Thanks.
Leslie Knope,Yeah.
Leslie Knope,"Gosh, you're filthy."
Leslie Knope,Go clean yourself up.
Leslie Knope,Try to look professional.
Leslie Knope,Hello.
Leslie Knope,Enjoy yourselves.
Leslie Knope,Hey.
Leslie Knope,I like your necklace.
April Ludgate,My God.
April Ludgate,He is just the best ever.
Andy Dwyer,You're the best ever.
Andy Dwyer,But he's a close second.
Andy Dwyer,"Aren't you, Little Sebastian?"
Ben Wyatt,He really is amazing.
Leslie Knope,"You finally get it now, right?"
Ben Wyatt,Hello? He's fantastic.
Ben Wyatt,I totally get it now.
Ben Wyatt,I don't get it.
Ben Wyatt,At all.
Ben Wyatt,It's kind of a small horse.
Ben Wyatt,"I mean, what am I missing? Am I crazy?"
Leslie Knope,"Hey, Ben, you just missed it! He whinnied!"
Ben Wyatt,"Yeah. No, I totally heard that."
Ben Wyatt,It was great.
