Character,Line
Leslie Knope,"I'm gonna kick all their asses! I am so fired up! I'm gonna go right now and drink, like, 1,000 Red Bulls so I can draft a new bill to undo abstinence only."
Ben Wyatt,"Man, you are just a machine."
Ben Wyatt,Get stuff done.
Ben Wyatt,"Hey, why don't you send it to me when you have a draft? I'll try to help."
Leslie Knope,You're the greatest.
Leslie Knope,"But you're gonna have to take out a lot of cursing, 'cause like I said, I am very fired up."
Ben Wyatt,"Well, you go get 'em."
Ben Wyatt,I love you.
Leslie Knope,I love you too.
Leslie Knope,What are you wearing?
Ben Wyatt,I can't do that right now.
April Ludgate,"Yo, you ready to go?"
Ben Wyatt,"Why, yes, I am, April! Let's go now!"
April Ludgate,What's wrong with you?
Ben Wyatt,"Wonderful! Hey, be careful out there."
Ben Wyatt,Traffic is nuts on the streets and roads.
April Ludgate,"Oh, no!"
April Ludgate,They got you!
Ben Wyatt,"Terrific! Hey, I'm hungry."
Ben Wyatt,"Ha, ha, ha, ha, ah, ha, ha."
Ben Wyatt,"Let's go eat some batteries I mean, human food."
April Ludgate,"Hey, uh, batteries I mean, human food sounds good to me."
April Ludgate,Wonderful.
Ben Wyatt,Let's go.
